{"all_runs":[{"artifact_count":3,"artifacts":{"candidate_pack":{"counts":{"source_blocks":79},"path":"PBLN_000000000103645/pipeline/source_selection.json","sha256":"077d835dd913c8ce62cc1274d3e5d8b84d983f249eedc5accd9234cc8bab69b4"},"common_ir":{"counts":{"blocks":115,"relations":0},"path":"PBLN_000000000103645/pipeline/common_ir_v1/PBLN_000000000103645.pdf.json","sha256":"23b4fbbd46ad4cee7b7177bb120ef95e70798bc21f297e9dab9a97aeea0fe05e"},"structured_profile":{"counts":{"comparison_facts":9,"support_components":2},"path":"PBLN_000000000103645/pipeline/structured_profile.v0.2.json","sha256":"1f8bd8f0ed87a77013888566daf594dd7014efc6aceb5fbe502664d9cc75eaa1"}},"logical_id":"PBLN_000000000103645","source":{"extension":"pdf","path":"PBLN_000000000103645/attachments/body_output__[붙임1] 국방 중소기업 역량강화사업 참여기업 모집 공고.pdf","sha256":"43b8739b7af9d847f4f2e037439574a85b84a8394d44d389bd442897ae0732b2"}},{"artifact_count":3,"artifacts":{"candidate_pack":{"counts":{"source_blocks":129},"path":"PBLN_000000000103818/pipeline/source_selection.json","sha256":"97368925a9cab7e01e8b6763d87696fa29c7d1d1ce226001833a1585590c948d"},"common_ir":{"counts":{"blocks":199,"relations":4},"path":"PBLN_000000000103818/pipeline/common_ir_v1/PBLN_000000000103818.hwp.json","sha256":"24c63e2687806b9e8005b04033b0f03ab4956faf69313a75458889c0eb7e0ad8"},"structured_profile":{"counts":{"comparison_facts":17,"support_components":4},"path":"PBLN_000000000103818/pipeline/structured_profile.v0.2.json","sha256":"a4488c39bd2f724c9d6c8a7f0704f3cecdb59627f896387623dedd17bcd17591"}},"logical_id":"PBLN_000000000103818","source":{"extension":"hwp","path":"PBLN_000000000103818/attachments/body_output__[붙임2-2] 수출지향형(해외진출R&D) 세부 지원내용.hwp","sha256":"6dc1ed1265fcf0cf686bd8734685db5046cb2dde399aac1451d9e1562362c390"}},{"artifact_count":3,"artifacts":{"candidate_pack":{"counts":{"source_blocks":33},"path":"PBLN_000000000104014/pipeline/source_selection.json","sha256":"249746aa781950761b64933faeef0322f21658e89b94d1fb21fd1a90d9de6b23"},"common_ir":{"counts":{"blocks":47,"relations":0},"path":"PBLN_000000000104014/pipeline/common_ir_v1/PBLN_000000000104014.hwp.json","sha256":"b1d3c87d1a3b4460f731bbcfbf32f3aed8f638514d616dab5d2bc77f36f49b6b"},"structured_profile":{"counts":{"comparison_facts":7,"support_components":4},"path":"PBLN_000000000104014/pipeline/structured_profile.v0.2.json","sha256":"7df9864556812b2007d644b6d614a5258623d5ca23ed5f593cbf9d02b183a737"}},"logical_id":"PBLN_000000000104014","source":{"extension":"hwp","path":"PBLN_000000000104014/attachments/body_output__공고문(2025년도 6차산업 분야별 지원사업 사업대상자 모집 공고).hwp","sha256":"6f7f6f9ac667eb94857156acf2549d39a584945663b9c09d3c5f8dfd815e55c2"}},{"artifact_count":3,"artifacts":{"candidate_pack":{"counts":{"source_blocks":125},"path":"PBLN_000000000104102/pipeline/source_selection.json","sha256":"3185b5078f14a54c3e726134eba49c79deee8483c76c02d37df59fac48b83f82"},"common_ir":{"counts":{"blocks":215,"relations":0},"path":"PBLN_000000000104102/pipeline/common_ir_v1/PBLN_000000000104102.pdf.json","sha256":"c88d1bf9b0bfbee030ccb733703b32fa0ce4fc79e139e47541e55e2cdf01a754"},"structured_profile":{"counts":{"comparison_facts":23,"support_components":0},"path":"PBLN_000000000104102/pipeline/structured_profile.v0.2.json","sha256":"761ac062f753451577f79b13d900939710a597f17cfe8d7fa55c5c5026864041"}},"logical_id":"PBLN_000000000104102","source":{"extension":"pdf","path":"PBLN_000000000104102/attachments/body_output__[제2025-49호]_2025년도_레전드50_스마트공장_구축지원사업_공고(안).pdf","sha256":"adb3eb763fe463ab4f4ff11c57186a4ff97531e68ffcda3aaa16bdc8abb7ded1"}},{"artifact_count":3,"artifacts":{"candidate_pack":{"counts":{"source_blocks":66},"path":"PBLN_000000000104127/pipeline/source_selection.json","sha256":"09be14926c053eb174f13952f310c06488cc3f64cfea2e11e47be79a91c08cb2"},"common_ir":{"counts":{"blocks":75,"relations":1},"path":"PBLN_000000000104127/pipeline/common_ir_v1/PBLN_000000000104127.hwp.json","sha256":"92f1c4d8a9f296856d9bcd9d5b1341b0b010890c5800e3c7ab8e352fa6c48b93"},"structured_profile":{"counts":{"comparison_facts":12,"support_components":5},"path":"PBLN_000000000104127/pipeline/structured_profile.v0.2.json","sha256":"52cfdabf6913b21300a198542c0b8535bf4eda2365982601885832c7d9f9b950"}},"logical_id":"PBLN_000000000104127","source":{"extension":"hwp","path":"PBLN_000000000104127/attachments/body_output__1.(공고문) 2025년 중견기업 핵심연구인력 성장지원사업.hwp","sha256":"76605f4ac8aa90cbf9b8b85dbb370c50f69c6e50bd949e36292d2930c4aae537"}},{"artifact_count":3,"artifacts":{"candidate_pack":{"counts":{"source_blocks":73},"path":"PBLN_000000000104630/pipeline/source_selection.json","sha256":"81636458a2567500e7ea7698aa3eaa5a946052311d07722951443e26dbfc6ae4"},"common_ir":{"counts":{"blocks":279,"relations":0},"path":"PBLN_000000000104630/pipeline/common_ir_v1/PBLN_000000000104630.pdf.json","sha256":"4ba18a5b18666387fcc3c3f0650e76dc89c3fd1c2dc4192432abba368df67613"},"structured_profile":{"counts":{"comparison_facts":9,"support_components":3},"path":"PBLN_000000000104630/pipeline/structured_profile.v0.2.json","sha256":"3603315c829833e2326f9d7ef418d2c38478eb43250abe1fa32dfd80e969e49a"}},"logical_id":"PBLN_000000000104630","source":{"extension":"pdf","path":"PBLN_000000000104630/attachments/body_output__해외(베트남)_오프라인_매장입점_소공인_상시모집_공고문.pdf","sha256":"c24911e3e285b2e3a631ba2a0104391945616c72d8a3ba3108d8a64aebe97497"}},{"artifact_count":3,"artifacts":{"candidate_pack":{"counts":{"source_blocks":137},"path":"PBLN_000000000104731/pipeline/source_selection.json","sha256":"14a15116839194420f59929581367b387a853fada6e5a482a6caa74cd45049fa"},"common_ir":{"counts":{"blocks":498,"relations":0},"path":"PBLN_000000000104731/pipeline/common_ir_v1/PBLN_000000000104731.pdf.json","sha256":"c134f2855988e30e1966cfb15ab6af86a8ad576db66d4b1044c433950223ce37"},"structured_profile":{"counts":{"comparison_facts":28,"support_components":4},"path":"PBLN_000000000104731/pipeline/structured_profile.v0.2.json","sha256":"6157b78c98fef57ee34d3c1d79c59872a78d7781f69f34381a10706f5e113d1a"}},"logical_id":"PBLN_000000000104731","source":{"extension":"pdf","path":"PBLN_000000000104731/attachments/body_output__[붙임]_2025년_민관협력_오픈이노베이션_지원사업_문제해결형_및_자율제안형_모집_공고문.pdf","sha256":"b21a17921c3e663659c6772a458ec9f9b74d53b7c505e824024717007ce5ba64"}},{"artifact_count":3,"artifacts":{"candidate_pack":{"counts":{"source_blocks":99},"path":"PBLN_000000000105043/pipeline/source_selection.json","sha256":"786abda4571b0aa2d60b9552d6501738cd22249b6935345f1027668e3c7a206b"},"common_ir":{"counts":{"blocks":182,"relations":8},"path":"PBLN_000000000105043/pipeline/common_ir_v1/PBLN_000000000105043.hwp.json","sha256":"e31beb31379005aae67cb8ca81930e2773f16aac61a89a5243e1798bf3f3039d"},"structured_profile":{"counts":{"comparison_facts":16,"support_components":4},"path":"PBLN_000000000105043/pipeline/structured_profile.v0.2.json","sha256":"6ae230a10a76c353434762f9ff8c929c6e7621365e75eaf7c71b60135f7aaaee"}},"logical_id":"PBLN_000000000105043","source":{"extension":"hwp","path":"PBLN_000000000105043/attachments/body_output__2025년도 부처협업형(의약품ᆞ의료기기) 스마트공장 구축 지원사업 공고.hwp","sha256":"cb6e9bf6c77f1c4cfc7b085c00d6af9d0496310d003541b0082c1bdde8e45b2b"}},{"artifact_count":3,"artifacts":{"candidate_pack":{"counts":{"source_blocks":8},"path":"PBLN_000000000105168/pipeline/source_selection.json","sha256":"97faf56751eb954d9802c544b7f771bdf96a86a61222759655b1139accd6b3b8"},"common_ir":{"counts":{"blocks":42,"relations":0},"path":"PBLN_000000000105168/pipeline/common_ir_v1/PBLN_000000000105168.hwp.json","sha256":"a0ffa0266ca81a0ec17b4eed04c2cf55052be9e9bd3a4c35cebfd94e16808e03"},"structured_profile":{"counts":{"comparison_facts":10,"support_components":2},"path":"PBLN_000000000105168/pipeline/structured_profile.v0.2.json","sha256":"2dc8ab1f14b1b7b04c5d80a2921595e0c9ce181def58ffa9c05743d6c41a90f2"}},"logical_id":"PBLN_000000000105168","source":{"extension":"hwp","path":"PBLN_000000000105168/attachments/body_output__[공고문] 2025년 글로벌 기술사업화 지원사업(북미) 참여기업 모집 공고.hwp","sha256":"7abb3823e25b4041bc8d0fee3e7f42464b3c61ebd7d2368947eb240da072b28d"}},{"artifact_count":3,"artifacts":{"candidate_pack":{"counts":{"source_blocks":9},"path":"PBLN_000000000105643/pipeline/source_selection.json","sha256":"1fa72cab1bfec274a902a5707f274169a77e73af6bc984380f8ee630e881a21e"},"common_ir":{"counts":{"blocks":28,"relations":0},"path":"PBLN_000000000105643/pipeline/common_ir_v1/PBLN_000000000105643.pdf.json","sha256":"e9070cc13c10768bf430993ff96d9dd093f31c602e642840779d5042d25ad0f5"},"structured_profile":{"counts":{"comparison_facts":3,"support_components":5},"path":"PBLN_000000000105643/pipeline/structured_profile.v0.2.json","sha256":"bc8fddd31b8987b02212b29b242c707b7188a057f2299d644b8094025d9c003b"}},"logical_id":"PBLN_000000000105643","source":{"extension":"pdf","path":"PBLN_000000000105643/attachments/body_output__[서울창조경제혁신센터] CJ온큐베이팅 공고문.pdf","sha256":"69898fa63f712ad09ee82c057355312052c7c1ec3b6b96bdfbc0c965a3514943"}},{"artifact_count":3,"artifacts":{"candidate_pack":{"counts":{"source_blocks":59},"path":"PBLN_000000000105758/pipeline/source_selection.json","sha256":"a70bb2f1c2f7739c4767af5ab49a15a078476621205bbb48146c279bf04097a0"},"common_ir":{"counts":{"blocks":93,"relations":1},"path":"PBLN_000000000105758/pipeline/common_ir_v1/PBLN_000000000105758.hwp.json","sha256":"6f0081c478bd9a025ccaf4928a60d7c0bbfbd0339996fa82d475a74aaece5530"},"structured_profile":{"counts":{"comparison_facts":30,"support_components":4},"path":"PBLN_000000000105758/pipeline/structured_profile.v0.2.json","sha256":"73cf0e9e92d74c95e75ede84b80dc27a965744871401f9735c3e076851cf483b"}},"logical_id":"PBLN_000000000105758","source":{"extension":"hwp","path":"PBLN_000000000105758/attachments/body_output__공고(제2025-11호)_2025년 삼익THK 스타트업 오픈이노베이션 지원사업 참여 스타트업 모집 공고(수정).hwp","sha256":"613cac34b051e29444c730584e2ae37bf80007cb886024fb5c42fa49381c7540"}},{"artifact_count":3,"artifacts":{"candidate_pack":{"counts":{"source_blocks":48},"path":"PBLN_000000000106070/pipeline/source_selection.json","sha256":"eb3571b2082f360f02cfd